{"arch":"gemma4","compatible_soc":["op12","op15"],"coverage_policy":"contiguous_partition","dtype":"f16","graph_hash":"sha256:b3c3cb5513880375f4d96a51ee23629e027baa8a3b3ed7551f34acbe5309d620","kind":"model_manifest","layout_version":3,"model_id":"gemma4-12b-f16","model_version":"sha256:a2116482dd84e547aed9e9b02621f38361e02ecaa0b55269e4d2e4e8a79558b5","n_layer_total":2,"partial_load_supported":true,"required_backends":[{"backend":"htp","backend_build":"sha256:80e787b89b1f1030d85c410e0d4f78607c94e98c85e74f84440832e8e1f4fca1","min_soc":"op12"}],"resident_ram_estimate_bytes":700,"schema_version":5,"source_sha256":"sha256:92f4b5110c7017a7c15225ec39c3b8166f6474be6efe4e3f0a5e5cec9ba2dae9","warmup_cmd":"warm --sentinel","weight_sets":[{"layer_range":{"end":1,"n_layer_total":2,"start":0},"set_digest":"sha256:3fa601b781e2ade54ab442125e635520389c4289329ba9ec2fd819e8e165ebc2","total_bytes":400,"weight_set_id":"ws1"},{"layer_range":{"end":2,"n_layer_total":2,"start":1},"set_digest":"sha256:7f7506b00fb6eab3debffe5dcf6db875e282ea86f528638a4de3c98c3278ff36","total_bytes":300,"weight_set_id":"ws2"}]}
